{
  "counts": {
    "left_cases": 60,
    "left_only_cases": 0,
    "matched_cases": 60,
    "right_cases": 60,
    "right_only_cases": 0,
    "shared_content_groups": 60
  },
  "identical_content_multiset": true,
  "left": {
    "manifest_sha256": "70ad5961d030ac119765a2e275f185794ec22ff593dd11c52fa1bf5153544627",
    "suite_id": "official-performance-2026"
  },
  "mappings": [
    {
      "expected_output_sha256": "79be94021cb4fea77c75e475ac5b9c7af312e1cc51704648424df6543da5e579",
      "input_sha256": "1570b6d5f67b17ae6f5b4213858de24e8654aed59d1f85c6d7d38f1f8952f862",
      "left_case_ids": [
        "rv64gc:fft2"
      ],
      "left_only_count": 0,
      "matched_count": 1,
      "right_case_ids": [
        "rv64gc:2025-2EI-3"
      ],
      "right_only_count": 0,
      "source_sha256": "06a9862e606589bd60db35172b809cd8a6ffb67f86f752d65189a1f4707f1e40",
      "status": "identical"
    },
    {
      "expected_output_sha256": "94749a8698dc11bccdae72cf4eccc466311ba28a1f711aaaaec294610b5a5a8c",
      "input_sha256": "2b0819a3be4c1510c4db3dc89d0653129e523b0f443c00c5fbf7187f58424228",
      "left_case_ids": [
        "rv64gc:fft0"
      ],
      "left_only_count": 0,
      "matched_count": 1,
      "right_case_ids": [
        "rv64gc:2025-RGP-36"
      ],
      "right_only_count": 0,
      "source_sha256": "06a9862e606589bd60db35172b809cd8a6ffb67f86f752d65189a1f4707f1e40",
      "status": "identical"
    },
    {
      "expected_output_sha256": "539f66976a0ec3350e5a380d261f7cf4ab9b08868c027ffa10edfd42829869b5",
      "input_sha256": "8e4affb2ddba89eb2b255a7a8b0c794fc79891d32aecb29d3fffcbc1b91bcc23",
      "left_case_ids": [
        "rv64gc:fft1"
      ],
      "left_only_count": 0,
      "matched_count": 1,
      "right_case_ids": [
        "rv64gc:2025-G46-5"
      ],
      "right_only_count": 0,
      "source_sha256": "06a9862e606589bd60db35172b809cd8a6ffb67f86f752d65189a1f4707f1e40",
      "status": "identical"
    },
    {
      "expected_output_sha256": "3c87d0120b5104ac868ce76174c887cb167af4e905ee99c73434a13050f5b1ea",
      "input_sha256": "1b26a97ed20d3ae3190157d761fed57bcdee3ab3aab4e02da6aab1fe5cf80403",
      "left_case_ids": [
        "rv64gc:knapsack_naive-1"
      ],
      "left_only_count": 0,
      "matched_count": 1,
      "right_case_ids": [
        "rv64gc:2025-3ZC-30"
      ],
      "right_only_count": 0,
      "source_sha256": "175f853fefa2d6126473dc544b4c8fccb5cf9681ec84f977a1e54a441f39b8e3",
      "status": "identical"
    },
    {
      "expected_output_sha256": "14c97e98340d641b9f758b68f68117ccd2aa5d8ec025e5fcb008e34160a2b1c3",
      "input_sha256": "297cae7f2ae5e39ddf3f925d04e82452b6580b4992b9ae71498d45f989084503",
      "left_case_ids": [
        "rv64gc:knapsack_naive-2"
      ],
      "left_only_count": 0,
      "matched_count": 1,
      "right_case_ids": [
        "rv64gc:2025-PJ9-8"
      ],
      "right_only_count": 0,
      "source_sha256": "175f853fefa2d6126473dc544b4c8fccb5cf9681ec84f977a1e54a441f39b8e3",
      "status": "identical"
    },
    {
      "expected_output_sha256": "daa75e946eede6f3b16099c33dbf03ec81cda08d6bdfc41ed49576ea2e8f1400",
      "input_sha256": "2d2bc7f2b619c034f445873d1c8a167434b0f75b8fed762edaecf8f1d413789d",
      "left_case_ids": [
        "rv64gc:knapsack_naive-3"
      ],
      "left_only_count": 0,
      "matched_count": 1,
      "right_case_ids": [
        "rv64gc:2025-67P-14"
      ],
      "right_only_count": 0,
      "source_sha256": "175f853fefa2d6126473dc544b4c8fccb5cf9681ec84f977a1e54a441f39b8e3",
      "status": "identical"
    },
    {
      "expected_output_sha256": "9cc40a1ed2f453fc1be776f0b5f8ccc38fb9974d44dd5e3d124e2d46cb863596",
      "input_sha256": "3cc875d0b7e20f963937c61f7cca8a8eb28615e7f83e4b01ecd61ace30ded4f6",
      "left_case_ids": [
        "rv64gc:h-8-01"
      ],
      "left_only_count": 0,
      "matched_count": 1,
      "right_case_ids": [
        "rv64gc:2025-YEI-35"
      ],
      "right_only_count": 0,
      "source_sha256": "19f915ff56ed133a538a959b68db5c9c8e29b04b39949b8de3c69c6370899b95",
      "status": "identical"
    },
    {
      "expected_output_sha256": "bea93ec1b976939730436d761eefa8704ffada96f9860d222c697f42da930fbf",
      "input_sha256": "a36c2c506c1aa6fe2ac3b1296a51b2f7288847ee4147292cae69a62a4ab7237a",
      "left_case_ids": [
        "rv64gc:h-8-02"
      ],
      "left_only_count": 0,
      "matched_count": 1,
      "right_case_ids": [
        "rv64gc:2025-CUU-11"
      ],
      "right_only_count": 0,
      "source_sha256": "19f915ff56ed133a538a959b68db5c9c8e29b04b39949b8de3c69c6370899b95",
      "status": "identical"
    },
    {
      "expected_output_sha256": "640a9a013063839a3deda7b79c5a196866a4540aeb34c5e75382e5dd1ba80240",
      "input_sha256": "ae3c43414fac104ddd18e476b4e8b8c999364fa8902ff5537797aaf33f99ecb5",
      "left_case_ids": [
        "rv64gc:h-8-03"
      ],
      "left_only_count": 0,
      "matched_count": 1,
      "right_case_ids": [
        "rv64gc:2025-GL0-4"
      ],
      "right_only_count": 0,
      "source_sha256": "19f915ff56ed133a538a959b68db5c9c8e29b04b39949b8de3c69c6370899b95",
      "status": "identical"
    },
    {
      "expected_output_sha256": "edb597577a9cbee4c51b9564524c8426f1d73894d331b9258ac3255abc1d0eac",
      "input_sha256": "26d08896d98085aa9e4f246335e616ed5deb2da4fdd9f0c3619812d3f3dbf76a",
      "left_case_ids": [
        "rv64gc:matmul3"
      ],
      "left_only_count": 0,
      "matched_count": 1,
      "right_case_ids": [
        "rv64gc:2025-FH0-62"
      ],
      "right_only_count": 0,
      "source_sha256": "200d4cad58debc427ccaf6220355255261fb3c79dde88429c9a5cdded8924275",
      "status": "identical"
    },
    {
      "expected_output_sha256": "36c34929f9abc3176ba8fc736fae9166ef04f4eb938ab1893247b7662bb2fdb3",
      "input_sha256": "83c02ac2d48c863dab2ccf6870455aadfc2cec073b8db269b517c879d76aa6d9",
      "left_case_ids": [
        "rv64gc:optimization_scheduling3"
      ],
      "left_only_count": 0,
      "matched_count": 1,
      "right_case_ids": [
        "rv64gc:2025-PXE-29"
      ],
      "right_only_count": 0,
      "source_sha256": "26a2ead92367d099eb7e25de650e63d42b07629f4b871d3e9b4c4401a92a5929",
      "status": "identical"
    },
    {
      "expected_output_sha256": "9cf353b6e9a2a53f3a376b4b3af8c8bdf46af95ce4c193e5bf4000fccbc756ed",
      "input_sha256": "eea8254c7500ba3de996aa8ad6af399183f04e17d4a8102fde539dbc93a90012",
      "left_case_ids": [
        "rv64gc:optimization_scheduling2"
      ],
      "left_only_count": 0,
      "matched_count": 1,
      "right_case_ids": [
        "rv64gc:2025-TGX-34"
      ],
      "right_only_count": 0,
      "source_sha256": "26a2ead92367d099eb7e25de650e63d42b07629f4b871d3e9b4c4401a92a5929",
      "status": "identical"
    },
    {
      "expected_output_sha256": "f438897fbf01e9c2dd01fccf2558bc48a8f5c340c97dd1d6e7cf5caeb3d20c2e",
      "input_sha256": "f0b5c2c2211c8d67ed15e75e656c7862d086e9245420892a7de62cd9ec582a06",
      "left_case_ids": [
        "rv64gc:optimization_scheduling1"
      ],
      "left_only_count": 0,
      "matched_count": 1,
      "right_case_ids": [
        "rv64gc:2025-6U4-15"
      ],
      "right_only_count": 0,
      "source_sha256": "26a2ead92367d099eb7e25de650e63d42b07629f4b871d3e9b4c4401a92a5929",
      "status": "identical"
    },
    {
      "expected_output_sha256": "aeae0e2b4130f290ddf095587b13def3a1909a71eca5759a87bb3e7f61ae861a",
      "input_sha256": "2ae50707ccc788d1b3fda2ce981f15d458aa2fbd071057616d56aa93e76d991a",
      "left_case_ids": [
        "rv64gc:sl1"
      ],
      "left_only_count": 0,
      "matched_count": 1,
      "right_case_ids": [
        "rv64gc:2025-EAR-48"
      ],
      "right_only_count": 0,
      "source_sha256": "284f82760dcb6b325ec0752b1f9802ef33160c78d0b6f7e1785244f9b8acaa52",
      "status": "identical"
    },
    {
      "expected_output_sha256": "17839e84d32ca9780e9e8e8357693d7d84bae4c0b7a8735a55dd391ecc7cd69c",
      "input_sha256": "6d6d1031f21c91715089f5daccb5e33b6d26a4ce501dd4de677cd7b04889df7f",
      "left_case_ids": [
        "rv64gc:sl2"
      ],
      "left_only_count": 0,
      "matched_count": 1,
      "right_case_ids": [
        "rv64gc:2025-FPU-45"
      ],
      "right_only_count": 0,
      "source_sha256": "284f82760dcb6b325ec0752b1f9802ef33160c78d0b6f7e1785244f9b8acaa52",
      "status": "identical"
    },
    {
      "expected_output_sha256": "6d764fd859d2a07c5e06aa6d472837616bddd0ad9743a90547567ca6385ecb6e",
      "input_sha256": "b0699ac9ad9290780b59b3b2724ed16d306f4a4e69c3865c966ece49369ab425",
      "left_case_ids": [
        "rv64gc:sl3"
      ],
      "left_only_count": 0,
      "matched_count": 1,
      "right_case_ids": [
        "rv64gc:2025-0XT-12"
      ],
      "right_only_count": 0,
      "source_sha256": "284f82760dcb6b325ec0752b1f9802ef33160c78d0b6f7e1785244f9b8acaa52",
      "status": "identical"
    },
    {
      "expected_output_sha256": "e4fceb1576fc2cac94d0049e1657eca322db5d58e165d6bddd053e5f0bf4b2f5",
      "input_sha256": "9b8f7a38ed6a771dd8762bec2fe24d56b848e424afa146a369724ee11ae2385d",
      "left_case_ids": [
        "rv64gc:03_sort3"
      ],
      "left_only_count": 0,
      "matched_count": 1,
      "right_case_ids": [
        "rv64gc:2025-8AD-57"
      ],
      "right_only_count": 0,
      "source_sha256": "2e74d4a326ac5e40a3edca1e52d08dd81c3ad57fe90741a2da0e4812b23842db",
      "status": "identical"
    },
    {
      "expected_output_sha256": "57d1576f9dd9213c82d24809cc1bf68db408b469da07207f260d5d388b0a43ad",
      "input_sha256": "df5fbd14691294fe4a021b0dbc15224495756beff8372cfbdf25d9d79a62a4e2",
      "left_case_ids": [
        "rv64gc:03_sort2"
      ],
      "left_only_count": 0,
      "matched_count": 1,
      "right_case_ids": [
        "rv64gc:2025-UHB-58"
      ],
      "right_only_count": 0,
      "source_sha256": "2e74d4a326ac5e40a3edca1e52d08dd81c3ad57fe90741a2da0e4812b23842db",
      "status": "identical"
    },
    {